682,MSI/ARM,9-Dec,Ohio Historical Society,State Archives of Ohio,"Archivist I, Government Records",Professional Permanent - Full Time,Columbus ,OH,Museum/Historical Society,"Archives/Conservation, Records Preservation/Management",Appraisal and Access Systems Courses,Extremely Relevant,"Time management, presentation skills, knowledge of appraisal, knowledge of access systems","Yes, History of Art VRC",Minimally,8,,Social727,,,Infinity Primary Care,,Support Analyst,Professional Permanent - Full Time,,MI,,,,,,,,,,Social754,MSI/IEMP/ICD,9-Apr,SocialToaster,,Account Manager,Professional Permanent - Full Time,,,,,,,,,,,,Social756,MSI/HCI,9-Apr,Self-Employed,,User Experience Designer,Professional Temporary - Part Time,Seattle,WA,Computer: Software/Internet,"Consulting, Usability (Human Factors Research/Information Architecture/Evaluation Design), Interface Design","Evaluation of systems and services, information architecture, interface and interaction design","Very relevant, courses where you make things most relevant","Interface design, usability assessment, user testing","Yes, UM Women in Science & Engineering Program",Extremely,3,,Social809,MSI,9-Apr,Mercedes-Benz Technology,,Cooperation Partner,Professional Permanent- Full Time,Troy,MI,,,,,,,,,,Social825,MSI/SLM/LIS,9-Dec,Lake Orion Community Schools,Stadium Drive Elementary for the Arts,Long-term Substitute Library Media Specialist,Professional Temporary - Full Time,Lake Orion,MI,Library: K-12 School,Library Services,Student teaching experience,Somewhat relevant,Did not answer,"No, but I was a student teacher at Birmingham Groves High School in Birmingham, MI and Springfield Plains Elementary school in Clarkston, MI",Extremely,10 - Extremely Satisfied,,Social827,MSI/HCI,9-Apr,Sears Holdings,Did not answer,User Experience Architect,Professional Permanent - Full Time,Chicago,IL,Computer: Software/Internet,E-Commerce/E-Marketing/Marketing/Competitive and Intelligence/Analysis,Working in teams and producing project deliverables,Extremely Relevant,"Researching users, creating deliverables to show potential employers, working in teams","Yes, Lisa P. Maxwell, Sears Holding",Extremely,7,,Social837,MSI/LIS,9-Apr,University of Michigan,Shapiro Undergraduate Library,Undergraduate Learning Librarian,Professional Permanent - Full Time,Ann Arbor,MI,Library: Academic,"Library Services (Youth/Adult Services, Cataloging, Children's Services, Collection Development/Acquisition, Indexing, Instruction/Training/Teaching and Library Services Administration)",SI 647,Somewhat relevant,"Knowing how to find informatioon resources.  This is a teaching position, and I had already obtained a 7-12 teaching certification","Yes, UM Hatcher Graduate Library",Extremely,9,,Social842,MSI/IEMP,9-Apr,SourceForge Inc,,Software Designer,Professional Permanent - Full Time,Dexter,MI,"Biotechnology/Pharmaceuticals, Computer: Software/Internet",Website/Database/Information Systems Development,Prior Employment,Extremely Relevant,"Statistical analysis, online community development, recommender and reputation system design skills, User interface design skills","Yes, MSU",Minimally,8,,History856,MSI/Tailored,9-Apr,University of Michigan Libraries,"Digital Conversion Unit, DLPS",Audio Digitization Specialist,Professional Temporary - Full Time,Ann Arbor,MI,Library: Academic,"Archives/Conservation, Digital Preservation/Digital Asset Management/Information Preservation","Internships were definitely paramount to getting the job!  The job was created out of a digital preservation internship I had, and created with me in mind.",Very relevant,Did not answer,"Yes, EMU, UM Library Preservation and Conservation, Bentley Historical Library (via Paul Conway grant-writing project)",Extremely,10 - Extremely Satisfied,,Social876,MSI/ARM,9-Apr,Jstor,,Production Librarian,Professional Permanent - Full Time,Ann Arbor,MI,,,,,,,,,,Social883,MSI/Tailored,9-May,General Electric,Aviation - IT,Information Management Leadership Program,Professional Permanent - Full Time,Cincinnati,OH,"Automotive/Transportation, Computer: Software/Internet, Consumer Products, Defense/Aerospace","Business Analysis/Development, Website/Database/Information Development, Website/Database/Information Systems Administration, E-Commerce/E-Marketing/Marketing/Competitive Intelligence/Analysis, Information Visualization, Usability, Incentive Centered Design, Project Management, Statistical/Data Analysis","The tailored specialization gave me a chance to attend a wide variety of courses in SI, CoE and the Business School",Very Relevant,"Project Management, Incentive-Centered Design","Yes, Dabur Inc, UMICHR",Neutral,8,,History909,MSI/LIS/SLM,9-Apr,Plymouth Canton Community School District,East Middle School,Library Media Specialist,Professional Permanent- Full Time,Plymouth,MI,Library: K-12 School,"Library Services (Youth/Adult Services, Cataloging, Children's Services, Collection Development/Acquisition, Indexing, Instruction/Training/Teaching and Library Services Administration)",Did not answer,Extremely Relevant,Did not answer,No,Did not answer,10 - Extremely Satisfied,,Electrical Engineering910,MSI/ICD,9-Apr,LittlePinch,,President,Professional Permanent - Full Time,,,Retail,,,,,,,,,Electrical Engineering914,MSI/HCI,9-Apr,University of Michigan,IRLEE,Research Associate,Professional Permanent - Part Time/Professional Temporary - Part Time,Ann Arbor,MI,Consulting,"Consulting, Project Management, and Research","Contextual inquiry, team/group work, networking, project management tools (GANTT charts, etc)",Very relevant,See 22,"Yes, UM Museum of Paleontology (short 2 credit internship)",Moderately,4,,Business916,MSI/HCI,9-Dec,VoyageurWeb,,User Interface Designer/Developer,Professional Permanent - Full Time,Mankato,MN,,,,,,,,,,Business936,MSI/ARM,9-Apr,"The Winthrop Group, Inc",Information and Archival Services,Archivist,Professional Permanent - Full Time,Morton Grove,IL,Consumer Products,Archives/Conservation and Consulting,"The PEP credits and internships available through SI were definitely the most helpful, along with the array of ARM courses",Very relevant,"Networking, archival processing, multi-tasking, ability to work on group projects, etc","Yes, The Coca Cola Company, Heritage Communications Department (Archives)",Extremely,8,,Education958,MSI/HCI,9-Apr,UM Ctools ,Sakai Project,Support Consultant & QA Tester,Professional Permanent - Full Time,Ann Arbor,MI,,,,,,,,,,Education968,MSI/K-12 SLM,9-Dec,Hawken School,,Upper School Librarian,Professional Permanent - Full Time,Cleveland,OH,Library: K-12 School,Library Services,"The internship, volunteer, and student teaching experiences (in other words, all of the practical, hands-on opportunities) were most valuable to me, as they were most impressive in my e-Portfolio, and gave me the ability to provide examples in my interviews.",Very Relevant,"Collection development, cataloging, and lesson planning are all integral to the position that I will be starting.","Yes, Public Library Associate at Ann Arbor District Library (Youth Services), Student Teaching at Beverly Elementary in Birmingham, MI and at International Academy in Bloomfield Hills, MI.",Extremely,9,,Education971,MSI/SLM,9-Dec,Alaska Geographic,,Vendor,Professional Permanent- Full Time,,AK,,Managing and operating a portion of the non-profit organization which provides educational programs for National Park visitors.,,,,,,,,Education992,MSI/ICD,9-Apr,Compuware,,Online Marketing Analyst & Architect,Professional Permanent - Full Time,Detroit,MI,,,,,,,,,,Education1009,MSI/HCI/SC,9-May,Oracle,User Experience,Interaction Design Intern,Professional Temporary - Full Time,Redwood Shores,CA,Computer: Software/Internet,Research,All HCI and Social Computing courses,Extremely Relevant,All HCI and SC courses,"Yes, UM Library",Not at all,7,,Education1018,MSI/IAR,8-Dec,Alexandria Investment Research and Technology,Did not answer,System Analyst,Professional Permanent - Full Time,Los Angeles,CA,"Computer: Software/Internet, Research","Website/Database/Information Systems Development, Information Visualization, Research, Search & Retrieval and Statistical/Data Analysis",Did not answer,Very relevant,Did not answer,Yes,Moderately,7,,Art1063,MSI/HCI,9-Apr,ForeSee Results,Usability,Usability Auditor,Professional Permanent - Full Time,Ann Arbor,MI,Computer: Software/Internet,Usability (Human Factors Research /Information Architecture/Evaluation Design),Work ethic,Extremely Relevant,"Contextual Inquiry, Project Management","Yes, Belkin",Neutral,10 - Extremely Satisfied,,Education1076,MSI/ARM,9-Apr,University of Michigan,ICPSR,Digital Preservation Projects Coordinator,Professional Temporary - Full Time,Ann Arbor,MI,University/College,"Digital Preservation/Digital Asset Management/Information Preservation, Project Management, Records Preservation/Management",The internship I completed during the summer between my first and second year directly led to this position,Somewhat relevant,"Knowledge of digital preservation and basic archival skills, technology skills","Yes, ICPSR Bentley Historical Library",Extremely,9,,Education1077,MSI/ICD,9-Dec,Syntel Inc,IT Consulting,Business Architect,Professional Permanent - Full Time,Phoenix,AZ,Consulting,"Business Analysis/Development, Consulting","All ICD courses especially Information Economics, E-Commerce and Contracting and signaling",Somewhat Relevant,"The projects, team work, and practical assignments","Yes, Deloitte & Touche",Extremely,8,,Education1104,MSI/ARM,9-Apr,Dickinson State University,Theodore Roosevelt Center,Coordinator/Archivist,Professional Permanent - Full Time,Dickinson,ND,"Museum/Historical Society, University/College","Archives/Conservation, Digital Preservation/Digital Asset Management/Information Preservation, Metadata & Taxonomy Creation/Management, Project Management",My skills which got my internship at the Smithsonian and at the Museum of Dentistry on campus work on their digital projects,Very relevant,"Project management, group work, metadata discussions, projects on metadata from Digital Preservation classes","Yes, Smithsonian Institute of Archives",Extremely,7,,Art1121,MSI/ARM/IPOL,9-Apr,United States House of Representatives,Office of History and Preservation,Research Assistant,Professional Permanent - Full Time,Washington,DC,Government,Archives/Conservation,"My summer internship at the National Archives in the Center for Lesgislative Archives contributed to my selection for this position because my current office works closely with the Center, so I was familiar with the work they did, had met my current supervisor last summer, and my supervisor from my summer internship was able to provide a solid reference for me.",Very relevant,"Archival training, team work, research and writing, critical thinking, policy analysis/writing","Yes, ASB 2008--Office of General Counsel, NARA, ASB 2009--Veterans History Project, Library of Congress Summer Internship 2008--Center for Legislative Archive, NARA",Extremely,8,,Education1122,MSI SC,9-May,Microsoft,Adcenter,Program Manager,ra,Redmond,WA,Computer: Software/Internet,"Project Management, Product Development",The entrepreneurship course was probably most helpful,Not very relevant,Probably the evaluation of systems and services methodology.  Some of the entrepreneurship as well should be important,"Yes, Troubadour Mobile",Extremely,5 - Satisfied,,Education1149,MSI/ARM,9-May,Clements Library,Did not answer,Project Archivist,Professional Temporary - Full Time,Ann Arbor,MI,University/College,Archives/Conservation,"Access Systems for Archives, Preservation",Very relevant,"EAD, MARC, appraisal","Yes, Bentley Historical Library, UM Law Library",Extremely,9,,Education1151,MSI/IEMP,9-May,Booz Allen Hamilton,Assurance and Resiliency,Tier 1 Consultant,Professional Permanent - Full Time,McLean,VA,Consulting,"Consulting, Information Security/Defense",Did not answer,Very relevant,"Information security incident analysis, enterprise information security planning, information security education.","Yes, Information Technology Industry Council",Neutral,10 - Extremely Satisfied,,Education1166,MSI,9-Apr,Federal Reserve Bank of San Francisco,Public Information,Web Developer,Professional Temporary - Full Time,San Francisco,CA,Financial Services/Banking,"Website/Database/Information Systems Development, Usability (Human Factors Research/Information Architecture/Evaluation Design)",Excellent academic reputation,Very relevant,"All Human Computer Interaction related knowledge, (Information) Economics Knowledge","Yes, SAP Labs",Extremely,9,,Economics1187,MSI/HCI,9-Dec,Thunderdome Media,,Web/Graphic Design,Professional Permanent- Full Time,Durbin,South Africa,Retail,,,,,,,,,Computer Science1192,MSI/HCI,9-May,Capital One,IT Division,Systems Business Analyst,Professional Permanent - Full Time,Richmond,VA,Financial Services/Banking,"Business Analysis/Development, Usability","SI 682, 501, 622, semester internship at UM Library usability group, group work",Extremely Relevant,"Presenation skills, report writing, requirements analysis, usability analysis","Yes, IBM, UM Library Usability Working Group",Extremely,9,,Economics1209,MSI/HCI,9-Apr,"Fuzzy Math, LLC",,Interaction Designer,Professional Permanent - Full Time,Chicago,IL,,,,,,,,,,Computer Science1237,ARM/LIS,9-Apr,National Archives and Records Administration,Textual Records,Archives Technician,Professional Temporary - Full Time,College Park,MD,Government,"Archives/Conservation, Digital Preservation/Digital Asset Management/Information Preservation, and Records Preservation/Management",Did not answer,Extremely Relevant,Did not answer,"Yes, Gerald Ford Presidential Library",Extremely,6,,Computer Science1243,MSI/HCI,9-Apr,University of Michigan ,English Language Institute,Research Assistant,Professional Temporary - Part Time,Ann Arbor,MI,Computer: Software/Internet,"Website/Database/Information Systems Development, Information Visualization, Usability (Human Factors Research/Information Architecture/Evaluation Design), Incentive Centered Design","HCI Courses, especially 622",Very relevant,"Usability testing, presenting and graphic design","Yes, Borqs Technology Ltd",Moderately,3,,Computer Science1245,MSI/IP,9-Apr,University of Michigan,Law Library,Associate Librarian,Professional Permanent - Full Time,Ann Arbor,MI,"Library: Academic, Library: Corporate/Special/Law",Library Services,Research and reference skills related to courses,Somewhat relevant,Teamwork and research skills,"Yes, UM Law Library",Extremely,10 - Extremely Satisfied,,Computer Science1255,MSI/LIS,9-Apr,IRS,"Department of the Treasury, Office of Chief Counsel - Library Division",Librarian,Professional Permanent - Full Time,Washington,DC,Library: Government,"Library Services (Youth/Adult Services, Cataloging, Children's Services, Collection Development/Acquisition, Indexing, Instruction/Training/Teaching, Library Services Administration)","As much as I hate to admit it, all of those forced group projects really helped me hone my organizational abilities.  Also, being exposed to a breadth of perspectives helped me be even more well-rounded",Very relevant,"It's difficult to say, because I don't exactly know what I'll be doing at my new job","Yes, Donald Hall Collection, US EPA",Moderately,4,,Library14,hci,6-May,Microsoft,User Experience Researcher,,prof perm ft,Mountain View,CA,"corp: hardware, corp: software, corp: product design",,"participating in the CHI student design competition, learning about social technologies and courses",extremely,research methods,,,9,,Computer Science21,lis,6-May,Procter & Gamble,Information Scientist,,prof perm ft,Cincinnati,OH,Corp: Special Library,,"group work, multi-disciplinary aspect of curriculum, courses",very,combination of technical and traditional library search skills,,,9,,Computer Science52,iemp,6-May,American Library Association,Technology Policy Analyst,,prof perm ft,Washington,DC,Community Information/Technology Org,,,very,,,,9,,Computer Science68,hci,6-Dec,Microsoft,Software Designer- Test,,prof perm ft,Redmond,WA,corp: software,,"intro to java, knowledge management, 501",somewhat,,,,9,,Computer Science163,hci,6-Dec,Aspera Inc,Usability Engineer,,prof perm ft,Emeryville,CA,corp: software,,"class presentation, SI 622, information architecture",somewhat,social skills,,,5,,Computer Science184,hci,6-May,Google,User Experience Researcher,,prof perm ft,Mountain View,CA,"Corp: web design, software, e-commerce",,group projects and specialization-specific courses,extremely,knowledge and competence in usability evaluation methods and user centered design principles,,,10,,English199,tailored,6-Dec,freelance,Information Architect,,prof temp ft,Ann Arbor,MI,"corp: web design, corp: ecommerce corp: consulting",,practical courses taught by adjunct faculty were the best for me as I was entering to a professional practice.  ,somewhat,"Networking (and understanding of networks), understanding of relations between math and systems, confidence and believe in informaiton as a discipline, IA, problem solving",,,8,,Computer Science217,hci,6-May,Lewis & Clark College- Masters in Education,Masters Student,,,Portland,OR,,,,,,,,,,Computer Science271,iemp,6-Dec,The Gallup Organization,Consulting Specialist,,prof perm ft,Chicago,IL,Corp: Consulting,,cognates in economics classes,somewhat,,,,,,Computer Science295,tailored,6-May,Internet Archive,Collections Manager,,prof perm ft,San Francisco,CA,"Corp: archive, digital archive",,degree and courses,very,that user advocacy is the whole point!,,,8,,Computer Science340,tailored,6-May,St. Jude Medical Center,Human Factors Design Engineer,,prof perm ft,Los Angeles,CA,"Healthcare, corp: software, corp: product design",,"courses, internships, research design courses",extremely,"interviewing users, observation, design heuristics and best practices, teamwork, psychology principles, basic mockup skills",,,10,,English434,tailored,,University of Michigan,,,prof perm ft,Ann Arbor,MI,university dept/service unit,,,,,,,,,English441,lis,6-May,Northcentral University,eReference Librarian,,prof perm ft,Prescott Valley,AZ,academic library,,sql programming course because of the hands on experience,somewhat,"thinking through reference questions, SQL database course",,,10,,English479,tailored,6-May,University of California San Diego,GIS Coordinator,,prof perm ft,La Jolla,CA,Academic Library,,All were important.  Reference class was a good foundation for the reference interview and resource identification,extremely,ability to understand the informaiton landscape and the myriad issues associated with technology/libraries/people,,,10,,English496,hci,6-May,Global Educational Excellence,Technology Director,,prof perm ft,Ann Arbor,MI,corp: consulting,,foundations classes,extremely,,,,5,,English501,arm,,Gale Group,,,prof perm ft,Farmington Hills,MI,corp: publishing,,,,,,,,,English508,hci,6-May,University of Michigan-Industrial Operations & Engineering,PhD student,,,Ann Arbor,MI,,,,,,,,,,English528,tailored,,Epic Systems,Technical Services Engineer,,prof perm ft,Madison,WI,"corp: healthcare, software",,,,,,,,,English537,hci,6-May,Deloitte U.S. firms,Usability Engineer,,prof perm ft,Nashville,TN,corp: web design,,"mock interview at SI Career services and UM career center, career services workshops, career services advising, sochi job listing, UM career center",very,"internship, web design, usability",,,9,,English559,hci,6-Dec,Google,User Experience Researcher,,prof perm ft,Mountain View,CA,"Corp: IT, Corp: e-commerce",,courses and internships,very,all skills gained in 622 and all of the HCI classes,,,7,,English573,lis,6-May,National Security Archive,Indexing Librarian,,prof perm ft,Washington,DC,Public Archive,,courses,very,teamwork ,,,8,,English738,tailored,6-Dec,Enlighten,Information Architect,,prof perm ft,Ann Arbor,MI,corp: web design,,"multiple usability internships, 622",very,understanding the importance of the user experience,,,9,,English780,iemp,6-May,Michigan Administrative Information Systems MAIS,Business Systems Analyst,,prof perm ft,Ann Arbor,MI,university dept/service unit,,,somewhat,,,,8,,English1095,tailored,6-May,University of Washington- School of Information,PhD student,,,,,,,,,,,,,,English1101,iemp,6-Dec,Chevron Corporation,Information Management Consultant,,prof perm ft,Houston ,TX,corporation: consulting,,career services workshops,very,,,,8,,English1195,hci,6-May,Lockheed Martin,Usability Specialist,,prof perm ft,Baltimore ,MD,corp: software,,"622, 682",very,working on project teams,,,10,,English15,HCI,8-Apr,University of Michigan-Medical School,User Experience Designer,,Professional Permanent - Full Time,Ann Arbor,MI,,,,,,,,,,English45,HCI,8-Apr,Bravo Health,Health Services Training and Development Specialist,,Professional Permanent - Full Time,Philadelphia,PA,Did not answer,3-4 months,Did not answer,"Yes, Ford Motor Company",Moderately,6,Yes,,"$55,500 ",English60,HCI,8-Apr,"Logistics Innovation Agency, U.S. Army",Logistics Management Specialist (Intern),,Professional Permanent - Full Time,New Cumberland,PA,Evaluate technology and business processes,"SI iTrack, contacts (personal and/or professional) and the presentation on PMF program",9,YES,,,,,"$39,795 ",English69,LIS,8-Apr,Chicago Public Library,Special Project Librarian,,Professional Permanent - Full Time,Chicago,IL,Did not answer,Less than 1 month,Did not answer,"Yes, Chicago Public Library",Extremely,7,YES,,"$50,000 ",English90,MSI/HCI,8-Dec,Self-employed,Did not answer,,Did not answer,Did not answer,"Kolkata, India","Financial Services/Banking, Engineering",Business Analysis/Development,None,"Not at all relevant, I'm in a managerial role","Diversity, ability to interact with different people","Yes, Onward Research & Innovation",Neutral,3,,Library111,ARM,8-Apr,Missouri History Museum,"Associate Archivist, Digitization",,Professional Permanent - Full Time,St. Louis,MO,"Editor, Industrial Quick Search",3-4 months,Knowledge of metadata standards and digital preservation,"Yes, City of Ann Arbor (Energy Dept)",Moderately,8,Yes,,"$30,000 ",Library175,MSI/HCI,8-Dec,HSN (Home Shopping Network?),Product Management,,Associate Product Manager (User Experience),Professional Permanent - Full Time,"St. Petersburg, FL",Arts/Entertainment,E-Commerce/E-Marketing/Marketing/Competitive Intelligence/Analysis,Internships,Extremely Relevant,All skills related to HCI like Adobe Suite and Contextual Inquiry,"Yes, Enterprise Rent-A-Car, Yahoo, Fry Inc, and Adler Planetarium",Extremely,8,,Library185,IEMP,8-Apr,School of Information - U of M,PhD Student,,Student,Ann Arbor,MI,"GSI, reasearch assistant, as my advisor demands","Internet sites, contacts (professional and/or personal), and professors",10 (Extremely Satisfied),YES,,,,,"$23,000 ",Library263,LIS,8-Apr,University of North Carolina (Chapel Hill),City & Regional Planning Librarian,,Professional Permanent - Full Time,Chapel Hill,NC,Did not answer,"Si iTrack, on-campus interviewing (through SI), internet sites, contacts (professional and/or personal), and listservs",10 (Extremely Satisfied),YES,,,,,"$45,000 ",Library355,ARM,8-Apr,University of California Berkeley,PhD Student,,Student,Berkeyley,CA,Student,Did not answer,10 (Extremely Satisfied),YES,,,,,"$22,000 ",Library363,MSI Tailored,8-Apr,Ann Arbor Hands-on Museum,"Evaluation, PR & Grants Specialist",,Professional Permanent - Full Time,Ann Arbor,MI,Did not answer,9-10 months,Did not answer,Did not answer,Did not answer,Did not answer,Did not answer,,"$24,000 ",Library390, HCI,8-Dec,urturn.com LLC,Did not answer,,Usability and Design Consultant,Professional Temporary - Full Time,"Ann Arbor, MI",Computer: Software/Internet,"Consulting, Website/Database/Information Systems Development, Usability, Product Development","SI 682, 522, 501 and 520",Extremely Relevant,Did not answer,"Yes, Hitachi, ProQuest, UM Medical School",Extremely,4,,Library446,ARM,8-Apr,Columbia University (Rare Book and Manuscript Library),Processing Archivist,,Professional Permanent - Full Time,New York,NY,"Process manuscript collections, train and supervise support staff and students and serve on university library committees","SI iTrack, Internet sites and listservs",9,YES,,,,,"$51,500 ",Library489,HCI,8-Apr,Microsoft Research,Assistant Researcher,,Professional Permanent - Full Time,"Bangalore, Karnataka",India,Software Developer,3-4 months,"Research skills (observations, evaluations, etc.), presenation skills, and analytical skills","Yes, Did a research projet w/Professor Lada Adamic and also worked on a project with John Deere through her",Moderately,10 - Extremely Satisfied,YES,,Not allowed to share,Library564,LIS,8-Apr,San Jose Public Library,Librarian I,,Professional Permanent - Full Time,San Jose,CA,"Reference and reader's advisory, public programming and outreach","SI iTrack, internet sites, and listservs",8,YES,,,,,"$60,700 ",Library566,HCI,8-Apr,Oracle,Usability Engineer Intern,,Professional Temporary-Full Time,San Francisco,CA,,,,,,,,,,Library583,IEMP,8-Apr,Silicon Storage Technology,Business Analyst ,,Professional Permanent - Full Time,San Francisco,CA,,,,,,,,,,Library623,LIS,8-Apr,Columbia University (Arthur Diamond Law Library),Electronic Resources Librarian,,Professional Permanent - Full Time,New York,NY,"Maintain access to electronic resources for law school community, implement library purchased software systems, and provide leadership in new technologies for the law library",Internet sites and contacts (professional and/or personal) ,10 (Extremely Satisfied),Did not answer,,,,,"$55 - $65,000",Library