643,ARM,8-Apr,National Archives and Records Administration,Archives Technician,,Professional Permanent - Full Time,College Park,MD,Did not answer,9-10 months,Did not answer,"Yes, I took the archives practicum and interned at the Bentley Historical Library.  I took part in ASB projects at the National Museum of the American Indian Cultural Resource Center and at the National Archives and Records Administration's Office of Presidential Libraries",Neutral,3,No,,"$33,269 ",Library686,LIS,8-Apr,University of Michigan Library,Special Projects Librarian,,Professional Temporary - Full Time,Ann Arbor,MI,"Donor Relations Writer, Boston University",11-12 months,"Project management, communicating in a group project setting, general knowledge of library operations, basic programming ability/knowledge, knowledge of technical services/ILS systems","Yes, UM Law Library",Extremely,9,Yes,,"$43,500 ",Library698,ARM,8-Apr,Duke University,archivist,,Did not answer,Durham,NC,,9-10 months,"Cataloging, EAD, web archiving, appraisal and electronic records management","Yes, Gerald R. Ford Presidential Library 2006-2008 and the Fort Hare trip with David Wallace in Summer 2007",Extremely,5 - Satisfied,YES,,"$31,750 ",Library745,IP,8-Apr,Information Services Group,Data Targeting Associate,,Professional Permanent - Full Time,Portland,OR,"Run data analysis on voters and voter actions for progressive organizations, come up with technology solutions to automate reporting and enable better voter outreach and provide training and support on voter targeting software for partner organizations","SI iTrack, internet sites, contacts (personal and/or professional), UM career center (job fairs, on-campus interviewing, Mployment Link) and listservs ",8,YES,,,,,"$50,000 ",Library751,MSI/MSW,8-Dec,University of Michigan,School of Information,,Research Intern,Professional Temporary - Full Time,"Ann Arbor, MI",University/College,"Community Information/Technology, project management and research",Community Information Corps Seminar,Extremely Relevant,"Contextual Design Skills, expertise on Social Networking sites and CSCW tools","Yes, UofM Office of the Provost, UofM Ross School of Business",Extremely,10 - Extremely Satisfied,,Library775,LIS,8-Apr,University of Texas at Arlington,"Librarian for Communication, English and History",,Professional Permanent - Full Time,Arlington,TX,Did not answer,3-4 months,"Comfort with technology, awareness of information architecture","Yes, ULA - Hatcher Graduate Library",Extremely,9,YES,,"$42,000 ",Library794,HCI,8-Apr,Enlighten,Information Architect,,Professional Permanent - Full Time,Ann Arbor,MI,"Collect data on user and client needs for web design, communicate design ideas to clients and developers and create blueprints and wireframes so that developers can build the website","SI iTrack, on-campus interviewing (through SI), contacts (professional and/or personal) and expoSItion",9,YES,,,,,"$60,000 ",Computer Science813,SC,8-Apr,Microsoft Corporation,User Experience Research,,Professional Permanent - Full Time,Seattle,WA,N/A,"SI iTrack, on-campus interviewing (through SI), Contacts (Professional and/or Personal)",10 (Extremely Satisfied),YES,,,,,"$80-$85,000",English845,ARM,8-Apr,Arizona State University,Project Archivist,,Professional Temporary - Full Time,Tempe ,AZ,N/A,7-8 months,"Information Management, general knowledge of Archival practices and experience with EAD","Yes, The Coca-Cola Company, The William L. Clements Library",Extremely,9,YES,,"$43,000 ",Art864,HCI,8-Apr,Blackbaud,Interaction Designer II,,Professional Permanent - Full Time,Charleston,SC,Did not answer,3-4 months,"Solid design principles, ability to both give and take constructive critique, and understanding the implications of usability","Yes, BioMedWare, Inc",Moderately,2,YES,,"$67,000 ",Art865,hci,8-Apr,University of Michigan-Marketing & Design,Web Project Manager,,Professional Permanent - Full Time,Ann Arbor,MI,,,,,,,,,,Art866,HCI,8-Apr,Third Coast Interactive,Owner,,Professional Permanent - Full Time,Milwaukee,WI,Did not answer,Did not answer,Did not answer,NO,,,,,Did not answer,Art867,ARM,8-Apr,New York Public Library,Assistant Field Service Librarian,,Professional Permanent - Full Time,New York,NY,"Graduate Student Instructor, UM Art & Design",5-6 months,"Flexibility/grasp of how to work independently and with busy people who are hard to reach, fluency with current technologies and their place in contemporary society (in the cultural heritage sector as well as other non-profit and for profit contexts), and the ability to build on foundation of specialized knowledge relevant to the preservation division as well as the library as a whole","Yes, The University Archives at the University of Fort Haire (Alice, South Africa)",Extremely,9,YES,,"$40,000+",Art879,LIS,8-Apr,University of Michigan (Hatcher Graduate Library),Public Services Librarian,,Professional Temporary - Full Time,Ann Arbor,MI,"In-person reference services, virtual reference services and technology consultations","SI iTrack, internet sites, contacts (personal and/or professional), UM career center (job fairs, on-campus interviewing, Mployment Link), other journals/newspapers and listservs ",3,YES,,,,,"$42,000 ",Art891, HCI,8-Apr,Stanford University,Data Specialist,,Professional Permanent - Full Time,Palo Alto,CA,Did not answer,11-12 months,"I understand better how organizations work, and that's helpful for somebody without prior full-time corporate or academic job experience","Yes, IBM",Neutral,7,Yes,,"$43,000 ",Art921,arm,8-Apr,Nebraska Historical Society,,,Professional Permanent - Full Time,,Nebraska,,,,,,,,,,Art985,ARM,8-Apr,Nuclear Regulatory Commission,Records Management Specialist,,Professional Permanent - Full Time,Rockville,MD,"Store Manager, KB Toys",More than 12 months (14 months),"Scanning, Digitization, Archiving and RM theory, Process development, Ehics and Technology","Yes, Buhr Conservation Facility",Neutral,7,Yes,,"$58,000 + bonus",Art1022,Tailored,8-Apr,ADR Chambers,Executive Director,,Professional Permanent - Full Time,Toronto,Ontario (Canada),"Deputy SG, Permanent Court of Arbitration ",11-12 months,"Organization needs assistance with information flows and to set up case management and other systems to automate various work processes, store and share (digital) information.  The technology is here, but people are not on board, so user-centered SI approach, as well as digital life-cycle and database skills are proving extremely useful.","Yes, Office of Legal Counsel (Crow Nation, Montana)",Minimally,5 (Satisfied),YES,,"$85,000 ",Art1091,LIS,8-Apr,ProQuest,Content Acquisitions Specialist,,Professional Permanent - Full Time,Ann Arbor,MI,"Use tracking tools and internal databases to monitor currency and completeness of assigned journal titles, communicate within the organization and with outside publishers to acquire content, and monitoring/maintaining internal databases","SI iTrack, on-campus interviewing (through SI), internet sites, contacts (professional and/or personal) and other journals/newspapers",3,YES,,,,,"$34,000 ",Library1100,ARM,8-Apr,"Detroit Public Library, National Automotive History",Librarian II,,Professional Permanent - Full Time,Detroit,MI,"Assisting patrons/researchers at reference desk, Process collections, and assist patrons with email/phone inquiries","SI iTrack, contacts (personal and/or professional) ",9,YES,,,,,"$47,000 ",Art1105,ARM,8-Apr,Earlham College,Assistant Archivist,,Professional Permanent - Full Time,Richmond,IN,"Arrangement and description of manuscript collections, EAD Finding aid creation, working with IT/librarians in digitization projects",Internet sites and listservs,10 (Extremely Satisfied),YES,,,,,"$38,000 ",Art1143,MSI,8-Dec,University of Michigan,Housing Information Technology Office ,,Senior Network Administrator,Professional Permanent - Full Time,"Ann Arbor, MI",University/College,"Website/Database/Information Systems Development, Website/Database/Information Systems Administration, Intellectual Property",My knowledge related to the information economy and intellectual property proved useful in obtaining my current position,Somewhat Relevant,The overall breadth of knowledge and information I gained by taking classes at SI has helped me tremendously at my current position,NO,N/A,7,,Art1145,IP,8-Apr,American Library Association,Information Techology Policy Analyst,,Professional Permanent - Full Time,Washington ,DC,Did not answer,1-2 months,Did not answer,"Yes, Creative Commons",Extremely,7,YES,,"$40 - $50,000",Art1155,LIS,8-Apr,Baker University,Electronic Services/ Government Documents Librarian,,Professional Permanent - Full Time,Baldwin City ,KS,"FDLP collection coordinator, electronic services manager, and liason to various consortia","SI iTrack, on-campus interviewing (through SI), contacts (professiona and/or personal), and listservs",9,YES,,,,,"$40,000 ",Art1232,HCI/IEMP,8-Apr,Yahoo!,Mobile Interaction Designer,,Professional Permanent - Full Time,Sunnyvale,CA,Design for Yahoo!  Mobile products,"Si iTrack, on-campus interviewing (through SI), internet sites, contacts (professional and/or personal), UM Career Center and listservs",9,YES,,,,,"$70,000 ",Art1236,ARM,8-Apr,Johns Hopkins University,Digital Archivist,,Professional Temporary - Full Time,Baltimore,MD,"SAA, ARMA",1-2 months,"Technology, problem solving and research abilities","Yes, Abbott Laboratories",Neutral,3,YES,,"$50,000 ",Computer Science